Time,Source,Destination,SrcPort,DstPort,Protocol,Frame,Ack,Bytes,Payload
1.106647,192.168.122.20,192.168.121.10,21,55956,TCP,16,15,74,"21 > 55956 [SYN, ACK] Seq=0 Ack=1 Win=28960 Len=0 MSS=1460 SACK_PERM=1 TSval=856436 TSecr=646877 WS=128"
1.107106,192.168.122.20,192.168.121.10,21,55956,TCP,19,18,66,21 > 55956 [ACK] Seq=1 Ack=257 Win=30080 Len=0 TSval=856436 TSecr=646878
1.108272,192.168.122.20,192.168.121.10,21,55956,TCP,21,20,66,21 > 55956 [ACK] Seq=1 Ack=513 Win=31104 Len=0 TSval=856436 TSecr=646878
1.109439,192.168.122.20,192.168.121.10,21,55956,TCP,23,22,66,21 > 55956 [ACK] Seq=1 Ack=769 Win=32256 Len=0 TSval=856436 TSecr=646878
1.113007,192.168.122.20,192.168.121.10,21,55956,TCP,25,24,66,21 > 55956 [ACK] Seq=1 Ack=1025 Win=33280 Len=0 TSval=856437 TSecr=646879
1.115576,192.168.122.20,192.168.121.10,21,55956,TCP,27,26,66,21 > 55956 [ACK] Seq=1 Ack=1281 Win=34432 Len=0 TSval=856438 TSecr=646880
1.118468,192.168.122.20,192.168.121.10,21,55956,TCP,29,28,66,21 > 55956 [ACK] Seq=1 Ack=1537 Win=35456 Len=0 TSval=856439 TSecr=646880
1.119380,192.168.122.20,192.168.121.10,21,55956,TCP,31,30,66,21 > 55956 [ACK] Seq=1 Ack=1793 Win=36480 Len=0 TSval=856439 TSecr=646881
1.120352,192.168.122.20,192.168.121.10,21,55956,TCP,33,32,66,21 > 55956 [ACK] Seq=1 Ack=2049 Win=37632 Len=0 TSval=856439 TSecr=646881
1.121482,192.168.122.20,192.168.121.10,21,55956,TCP,35,34,66,21 > 55956 [ACK] Seq=1 Ack=2305 Win=38656 Len=0 TSval=856440 TSecr=646881
1.122598,192.168.122.20,192.168.121.10,21,55956,TCP,37,36,66,21 > 55956 [ACK] Seq=1 Ack=2561 Win=39680 Len=0 TSval=856440 TSecr=646882
1.123642,192.168.122.20,192.168.121.10,21,55956,TCP,39,38,66,21 > 55956 [ACK] Seq=1 Ack=2817 Win=40832 Len=0 TSval=856440 TSecr=646882
1.131447,192.168.122.20,192.168.121.10,21,55956,TCP,42,41,66,21 > 55956 [ACK] Seq=1 Ack=4521 Win=44800 Len=0 TSval=856442 TSecr=646884
1.131694,192.168.122.20,192.168.121.10,21,55956,TCP,44,43,66,21 > 55956 [ACK] Seq=1 Ack=4609 Win=44800 Len=0 TSval=856442 TSecr=646884
1.133156,192.168.122.20,192.168.121.10,21,55956,TCP,46,45,66,21 > 55956 [ACK] Seq=1 Ack=4865 Win=47616 Len=0 TSval=856442 TSecr=646884
1.133411,192.168.122.20,192.168.121.10,21,55956,TCP,48,47,66,21 > 55956 [ACK] Seq=1 Ack=5121 Win=50560 Len=0 TSval=856442 TSecr=646884
1.134734,192.168.122.20,192.168.121.10,21,55956,TCP,50,49,66,21 > 55956 [ACK] Seq=1 Ack=5377 Win=53504 Len=0 TSval=856443 TSecr=646885
1.136044,192.168.122.20,192.168.121.10,21,55956,TCP,52,51,66,21 > 55956 [ACK] Seq=1 Ack=5633 Win=56320 Len=0 TSval=856443 TSecr=646885
1.138742,192.168.122.20,192.168.121.10,21,55956,TCP,54,53,66,21 > 55956 [ACK] Seq=1 Ack=5889 Win=59264 Len=0 TSval=856444 TSecr=646886
1.140715,192.168.122.20,192.168.121.10,21,55956,TCP,56,55,66,21 > 55956 [ACK] Seq=1 Ack=6145 Win=62208 Len=0 TSval=856444 TSecr=646886
1.140950,192.168.122.20,192.168.121.10,21,55956,TCP,58,57,66,21 > 55956 [ACK] Seq=1 Ack=6401 Win=65024 Len=0 TSval=856444 TSecr=646886
1.141798,192.168.122.20,192.168.121.10,21,55956,TCP,60,59,66,21 > 55956 [ACK] Seq=1 Ack=6657 Win=67968 Len=0 TSval=856445 TSecr=646886
1.142796,192.168.122.20,192.168.121.10,21,55956,TCP,63,62,66,21 > 55956 [ACK] Seq=1 Ack=6913 Win=70784 Len=0 TSval=856445 TSecr=646887
1.143878,192.168.122.20,192.168.121.10,21,55956,TCP,65,64,66,21 > 55956 [ACK] Seq=1 Ack=7169 Win=73728 Len=0 TSval=856445 TSecr=646887
1.151757,192.168.122.20,192.168.121.10,21,55956,TCP,68,67,66,21 > 55956 [ACK] Seq=1 Ack=8873 Win=79488 Len=0 TSval=856447 TSecr=646889
1.151892,192.168.122.20,192.168.121.10,21,55956,TCP,70,69,66,21 > 55956 [ACK] Seq=1 Ack=8961 Win=79488 Len=0 TSval=856447 TSecr=646889
1.152690,192.168.122.20,192.168.121.10,21,55956,TCP,72,71,66,21 > 55956 [ACK] Seq=1 Ack=9217 Win=82432 Len=0 TSval=856447 TSecr=646889
1.160946,192.168.122.20,192.168.121.10,21,55956,TCP,75,,78,[TCP Window Update] 21 > 55956 [ACK] Seq=1 Ack=9217 Win=85376 Len=0 TSval=856449 TSecr=646889 SLE=9473 SRE=10921
1.162531,192.168.122.20,192.168.121.10,21,55956,TCP,77,74,66,21 > 55956 [ACK] Seq=1 Ack=10921 Win=88192 Len=0 TSval=856450 TSecr=646892
1.164701,192.168.122.20,192.168.121.10,21,55956,TCP,79,78,66,21 > 55956 [ACK] Seq=1 Ack=11521 Win=91136 Len=0 TSval=856450 TSecr=646892
1.165292,192.168.122.20,192.168.121.10,21,55956,TCP,81,80,66,21 > 55956 [ACK] Seq=1 Ack=12033 Win=93952 Len=0 TSval=856450 TSecr=646892
1.165853,192.168.122.20,192.168.121.10,21,55956,TCP,83,82,66,21 > 55956 [ACK] Seq=1 Ack=12289 Win=96896 Len=0 TSval=856451 TSecr=646892
1.166716,192.168.122.20,192.168.121.10,21,55956,TCP,85,84,66,21 > 55956 [ACK] Seq=1 Ack=12545 Win=99840 Len=0 TSval=856451 TSecr=646893
1.168768,192.168.122.20,192.168.121.10,21,55956,TCP,87,86,66,21 > 55956 [ACK] Seq=1 Ack=12801 Win=102656 Len=0 TSval=856451 TSecr=646893
1.176416,192.168.122.20,192.168.121.10,21,55956,TCP,90,89,66,21 > 55956 [ACK] Seq=1 Ack=14505 Win=108544 Len=0 TSval=856453 TSecr=646895
1.183678,192.168.122.20,192.168.121.10,21,55956,TCP,93,92,66,21 > 55956 [ACK] Seq=1 Ack=16041 Win=111360 Len=0 TSval=856455 TSecr=646897
1.184305,192.168.122.20,192.168.121.10,21,55956,TCP,95,94,66,21 > 55956 [ACK] Seq=1 Ack=16129 Win=111360 Len=0 TSval=856455 TSecr=646897
1.185422,192.168.122.20,192.168.121.10,21,55956,TCP,97,96,66,21 > 55956 [ACK] Seq=1 Ack=16385 Win=114304 Len=0 TSval=856455 TSecr=646897
1.186475,192.168.122.20,192.168.121.10,21,55956,TCP,99,98,66,21 > 55956 [ACK] Seq=1 Ack=16641 Win=117120 Len=0 TSval=856456 TSecr=646897
1.187077,192.168.122.20,192.168.121.10,21,55956,TCP,101,100,66,21 > 55956 [ACK] Seq=1 Ack=16897 Win=120064 Len=0 TSval=856456 TSecr=646898
1.187531,192.168.122.20,192.168.121.10,21,55956,TCP,103,102,66,21 > 55956 [ACK] Seq=1 Ack=17153 Win=123008 Len=0 TSval=856456 TSecr=646898
1.195136,192.168.122.20,192.168.121.10,21,55956,TCP,106,105,66,21 > 55956 [ACK] Seq=1 Ack=18857 Win=128768 Len=0 TSval=856458 TSecr=646900
1.195369,192.168.122.20,192.168.121.10,21,55956,TCP,108,107,66,21 > 55956 [ACK] Seq=1 Ack=18945 Win=128768 Len=0 TSval=856458 TSecr=646900
1.196182,192.168.122.20,192.168.121.10,21,55956,TCP,110,109,66,21 > 55956 [ACK] Seq=1 Ack=19201 Win=131712 Len=0 TSval=856458 TSecr=646900
1.204232,192.168.122.20,192.168.121.10,21,55956,TCP,113,,78,[TCP Window Update] 21 > 55956 [ACK] Seq=1 Ack=19201 Win=134528 Len=0 TSval=856460 TSecr=646900 SLE=19457 SRE=20905
1.206516,192.168.122.20,192.168.121.10,21,55956,TCP,115,112,66,21 > 55956 [ACK] Seq=1 Ack=20905 Win=137472 Len=0 TSval=856461 TSecr=646903
1.213046,192.168.122.20,192.168.121.10,21,55956,TCP,118,117,66,21 > 55956 [ACK] Seq=1 Ack=22953 Win=143232 Len=0 TSval=856462 TSecr=646904
1.213313,192.168.122.20,192.168.121.10,21,55956,TCP,120,119,66,21 > 55956 [ACK] Seq=1 Ack=23041 Win=143232 Len=0 TSval=856462 TSecr=646904
1.213952,192.168.122.20,192.168.121.10,21,55956,TCP,122,121,66,21 > 55956 [ACK] Seq=1 Ack=23297 Win=146176 Len=0 TSval=856463 TSecr=646904
1.215049,192.168.122.20,192.168.121.10,21,55956,TCP,124,123,66,21 > 55956 [ACK] Seq=1 Ack=23553 Win=148992 Len=0 TSval=856463 TSecr=646905
1.216106,192.168.122.20,192.168.121.10,21,55956,TCP,126,125,66,21 > 55956 [ACK] Seq=1 Ack=23809 Win=151936 Len=0 TSval=856463 TSecr=646905
1.218475,192.168.122.20,192.168.121.10,21,55956,TCP,128,127,66,21 > 55956 [ACK] Seq=1 Ack=24065 Win=154880 Len=0 TSval=856464 TSecr=646905
1.218937,192.168.122.20,192.168.121.10,21,55956,TCP,130,129,66,21 > 55956 [ACK] Seq=1 Ack=24321 Win=157696 Len=0 TSval=856464 TSecr=646906
1.219758,192.168.122.20,192.168.121.10,21,55956,TCP,132,131,66,21 > 55956 [ACK] Seq=1 Ack=24577 Win=160640 Len=0 TSval=856464 TSecr=646906
1.220670,192.168.122.20,192.168.121.10,21,55956,TCP,134,133,66,21 > 55956 [ACK] Seq=1 Ack=24833 Win=163456 Len=0 TSval=856464 TSecr=646906
1.221731,192.168.122.20,192.168.121.10,21,55956,TCP,136,135,66,21 > 55956 [ACK] Seq=1 Ack=25089 Win=166400 Len=0 TSval=856465 TSecr=646906
1.229478,192.168.122.20,192.168.121.10,21,55956,TCP,139,138,66,21 > 55956 [ACK] Seq=1 Ack=26793 Win=172160 Len=0 TSval=856466 TSecr=646908
1.229694,192.168.122.20,192.168.121.10,21,55956,TCP,141,140,66,21 > 55956 [ACK] Seq=1 Ack=26881 Win=172160 Len=0 TSval=856467 TSecr=646908
1.237122,192.168.122.20,192.168.121.10,21,55956,TCP,144,,78,[TCP Window Update] 21 > 55956 [ACK] Seq=1 Ack=26881 Win=175104 Len=0 TSval=856468 TSecr=646908 SLE=27137 SRE=28585
1.238646,192.168.122.20,192.168.121.10,21,55956,TCP,146,143,66,21 > 55956 [ACK] Seq=1 Ack=28585 Win=178048 Len=0 TSval=856469 TSecr=646911
1.238801,192.168.122.20,192.168.121.10,21,55956,TCP,148,147,66,21 > 55956 [ACK] Seq=1 Ack=28929 Win=180864 Len=0 TSval=856469 TSecr=646911
1.239097,192.168.122.20,192.168.121.10,21,55956,TCP,150,149,66,21 > 55956 [ACK] Seq=1 Ack=29185 Win=183808 Len=0 TSval=856469 TSecr=646911
1.240210,192.168.122.20,192.168.121.10,21,55956,TCP,152,151,66,21 > 55956 [ACK] Seq=1 Ack=29441 Win=185856 Len=0 TSval=856469 TSecr=646911
1.241282,192.168.122.20,192.168.121.10,21,55956,TCP,154,153,66,21 > 55956 [ACK] Seq=1 Ack=29697 Win=185856 Len=0 TSval=856469 TSecr=646911
1.242435,192.168.122.20,192.168.121.10,21,55956,TCP,156,155,66,21 > 55956 [ACK] Seq=1 Ack=29953 Win=185856 Len=0 TSval=856470 TSecr=646912
1.243585,192.168.122.20,192.168.121.10,21,55956,TCP,158,157,66,21 > 55956 [ACK] Seq=1 Ack=30209 Win=185856 Len=0 TSval=856470 TSecr=646912
1.244601,192.168.122.20,192.168.121.10,21,55956,TCP,160,159,66,21 > 55956 [ACK] Seq=1 Ack=30465 Win=185856 Len=0 TSval=856470 TSecr=646912
1.245651,192.168.122.20,192.168.121.10,21,55956,TCP,162,161,66,21 > 55956 [ACK] Seq=1 Ack=30721 Win=185856 Len=0 TSval=856471 TSecr=646912
1.466790,192.168.122.20,192.168.121.10,21,55956,TCP,167,165,78,21 > 55956 [ACK] Seq=1 Ack=33873 Win=185856 Len=0 TSval=856526 TSecr=646917 SLE=30721 SRE=30977
1.467202,192.168.122.20,192.168.121.10,21,55956,TCP,170,168,66,21 > 55956 [ACK] Seq=1 Ack=35321 Win=185856 Len=0 TSval=856526 TSecr=646968
1.467462,192.168.122.20,192.168.121.10,21,55956,TCP,172,,78,[TCP Dup ACK 170#1] 21 > 55956 [ACK] Seq=1 Ack=35321 Win=185856 Len=0 TSval=856526 TSecr=646968 SLE=36769 SRE=38217
1.467614,192.168.122.20,192.168.121.10,21,55956,TCP,174,,78,[TCP Dup ACK 170#2] 21 > 55956 [ACK] Seq=1 Ack=35321 Win=185856 Len=0 TSval=856526 TSecr=646968 SLE=36769 SRE=39665
1.694713,192.168.122.20,192.168.121.10,21,55956,TCP,177,173,66,21 > 55956 [ACK] Seq=1 Ack=39665 Win=184064 Len=0 TSval=856583 TSecr=647025
1.695315,192.168.122.20,192.168.121.10,21,55956,TCP,180,,78,[TCP Window Update] 21 > 55956 [ACK] Seq=1 Ack=39665 Win=185856 Len=0 TSval=856583 TSecr=647025 SLE=41113 SRE=42561
1.695423,192.168.122.20,192.168.121.10,21,55956,TCP,182,,78,[TCP Dup ACK 180#1] 21 > 55956 [ACK] Seq=1 Ack=39665 Win=185856 Len=0 TSval=856583 TSecr=647025 SLE=41113 SRE=44009
1.696145,192.168.122.20,192.168.121.10,21,55956,TCP,184,,78,[TCP Dup ACK 180#2] 21 > 55956 [ACK] Seq=1 Ack=39665 Win=185856 Len=0 TSval=856583 TSecr=647025 SLE=41113 SRE=45457
1.696382,192.168.122.20,192.168.121.10,21,55956,TCP,186,,78,[TCP Dup ACK 180#3] 21 > 55956 [ACK] Seq=1 Ack=39665 Win=185856 Len=0 TSval=856583 TSecr=647025 SLE=41113 SRE=46905
1.696561,192.168.122.20,192.168.121.10,21,55956,TCP,188,,78,[TCP Dup ACK 180#4] 21 > 55956 [ACK] Seq=1 Ack=39665 Win=185856 Len=0 TSval=856583 TSecr=647025 SLE=41113 SRE=48353
1.696765,192.168.122.20,192.168.121.10,21,55956,TCP,191,187,66,21 > 55956 [ACK] Seq=1 Ack=48353 Win=180992 Len=0 TSval=856583 TSecr=647025
1.696856,192.168.122.20,192.168.121.10,21,55956,TCP,193,190,66,21 > 55956 [ACK] Seq=1 Ack=49801 Win=179968 Len=0 TSval=856583 TSecr=647025
1.696987,192.168.122.20,192.168.121.10,21,55956,TCP,195,194,66,21 > 55956 [ACK] Seq=1 Ack=52697 Win=185856 Len=0 TSval=856583 TSecr=647025
1.697191,192.168.122.20,192.168.121.10,21,55956,TCP,198,197,66,21 > 55956 [ACK] Seq=1 Ack=55593 Win=185088 Len=0 TSval=856583 TSecr=647025
1.697336,192.168.122.20,192.168.121.10,21,55956,TCP,201,200,66,21 > 55956 [ACK] Seq=1 Ack=58489 Win=185088 Len=0 TSval=856583 TSecr=647025
1.697504,192.168.122.20,192.168.121.10,21,55956,TCP,204,203,66,21 > 55956 [ACK] Seq=1 Ack=61385 Win=185088 Len=0 TSval=856584 TSecr=647025
1.697674,192.168.122.20,192.168.121.10,21,55956,TCP,207,206,66,21 > 55956 [ACK] Seq=1 Ack=64281 Win=185088 Len=0 TSval=856584 TSecr=647025
1.697952,192.168.122.20,192.168.121.10,21,55956,TCP,210,,78,[TCP Window Update] 21 > 55956 [ACK] Seq=1 Ack=64281 Win=185856 Len=0 TSval=856584 TSecr=647025 SLE=65729 SRE=67177
1.698150,192.168.122.20,192.168.121.10,21,55956,TCP,212,,78,[TCP Dup ACK 210#1] 21 > 55956 [ACK] Seq=1 Ack=64281 Win=185856 Len=0 TSval=856584 TSecr=647025 SLE=65729 SRE=68625
1.698311,192.168.122.20,192.168.121.10,21,55956,TCP,214,,78,[TCP Dup ACK 210#2] 21 > 55956 [ACK] Seq=1 Ack=64281 Win=185856 Len=0 TSval=856584 TSecr=647025 SLE=65729 SRE=70073
1.699104,192.168.122.20,192.168.121.10,21,55956,TCP,216,213,66,21 > 55956 [ACK] Seq=1 Ack=70073 Win=183040 Len=0 TSval=856584 TSecr=647026
1.699474,192.168.122.20,192.168.121.10,21,55956,TCP,219,218,66,21 > 55956 [ACK] Seq=1 Ack=72969 Win=185088 Len=0 TSval=856584 TSecr=647026
1.699678,192.168.122.20,192.168.121.10,21,55956,TCP,222,221,66,21 > 55956 [ACK] Seq=1 Ack=75865 Win=185088 Len=0 TSval=856584 TSecr=647026
1.699871,192.168.122.20,192.168.121.10,21,55956,TCP,225,224,66,21 > 55956 [ACK] Seq=1 Ack=78761 Win=185088 Len=0 TSval=856584 TSecr=647026
1.700097,192.168.122.20,192.168.121.10,21,55956,TCP,228,226,66,21 > 55956 [ACK] Seq=1 Ack=80209 Win=185856 Len=0 TSval=856584 TSecr=647026
1.700229,192.168.122.20,192.168.121.10,21,55956,TCP,230,,78,[TCP Dup ACK 228#1] 21 > 55956 [ACK] Seq=1 Ack=80209 Win=185856 Len=0 TSval=856584 TSecr=647026 SLE=81657 SRE=83105
1.700350,192.168.122.20,192.168.121.10,21,55956,TCP,232,,78,[TCP Dup ACK 228#2] 21 > 55956 [ACK] Seq=1 Ack=80209 Win=185856 Len=0 TSval=856584 TSecr=647026 SLE=81657 SRE=84553
1.700471,192.168.122.20,192.168.121.10,21,55956,TCP,234,,78,[TCP Dup ACK 228#3] 21 > 55956 [ACK] Seq=1 Ack=80209 Win=185856 Len=0 TSval=856584 TSecr=647026 SLE=81657 SRE=86001
1.700597,192.168.122.20,192.168.121.10,21,55956,TCP,236,233,66,21 > 55956 [ACK] Seq=1 Ack=86001 Win=183040 Len=0 TSval=856584 TSecr=647026
1.700743,192.168.122.20,192.168.121.10,21,55956,TCP,239,237,66,21 > 55956 [ACK] Seq=1 Ack=87449 Win=185856 Len=0 TSval=856584 TSecr=647026
1.700876,192.168.122.20,192.168.121.10,21,55956,TCP,241,,78,[TCP Dup ACK 239#1] 21 > 55956 [ACK] Seq=1 Ack=87449 Win=185856 Len=0 TSval=856584 TSecr=647026 SLE=88897 SRE=90345
1.700999,192.168.122.20,192.168.121.10,21,55956,TCP,243,,78,[TCP Dup ACK 239#2] 21 > 55956 [ACK] Seq=1 Ack=87449 Win=185856 Len=0 TSval=856584 TSecr=647026 SLE=88897 SRE=91793
1.701126,192.168.122.20,192.168.121.10,21,55956,TCP,245,,78,[TCP Dup ACK 239#3] 21 > 55956 [ACK] Seq=1 Ack=87449 Win=185856 Len=0 TSval=856584 TSecr=647026 SLE=88897 SRE=93241
2.310674,192.168.122.20,192.168.121.10,21,55956,TCP,250,244,66,21 > 55956 [ACK] Seq=1 Ack=93241 Win=183040 Len=0 TSval=856737 TSecr=647179
2.310984,192.168.122.20,192.168.121.10,21,55956,TCP,253,252,66,21 > 55956 [ACK] Seq=1 Ack=96137 Win=185088 Len=0 TSval=856737 TSecr=647179
2.311127,192.168.122.20,192.168.121.10,21,55956,TCP,256,255,66,21 > 55956 [ACK] Seq=1 Ack=99033 Win=185088 Len=0 TSval=856737 TSecr=647179
2.311239,192.168.122.20,192.168.121.10,21,55956,TCP,259,258,66,21 > 55956 [ACK] Seq=1 Ack=101929 Win=185088 Len=0 TSval=856737 TSecr=647179
2.322807,192.168.122.20,192.168.121.10,21,55956,TCP,263,262,66,21 > 55956 [ACK] Seq=1 Ack=106273 Win=185856 Len=0 TSval=856740 TSecr=647182
2.323060,192.168.122.20,192.168.121.10,21,55956,TCP,266,,78,[TCP Dup ACK 263#1] 21 > 55956 [ACK] Seq=1 Ack=106273 Win=185856 Len=0 TSval=856740 TSecr=647182 SLE=107721 SRE=109169
2.323267,192.168.122.20,192.168.121.10,21,55956,TCP,268,,78,[TCP Dup ACK 263#2] 21 > 55956 [ACK] Seq=1 Ack=106273 Win=185856 Len=0 TSval=856740 TSecr=647182 SLE=107721 SRE=110617
2.323438,192.168.122.20,192.168.121.10,21,55956,TCP,270,,78,[TCP Dup ACK 263#3] 21 > 55956 [ACK] Seq=1 Ack=106273 Win=185856 Len=0 TSval=856740 TSecr=647182 SLE=107721 SRE=112065
2.323634,192.168.122.20,192.168.121.10,21,55956,TCP,272,269,66,21 > 55956 [ACK] Seq=1 Ack=112065 Win=183040 Len=0 TSval=856740 TSecr=647182
2.334653,192.168.122.20,192.168.121.10,21,55956,TCP,276,273,78,21 > 55956 [ACK] Seq=1 Ack=113513 Win=185856 Len=0 TSval=856743 TSecr=647182 SLE=114961 SRE=116409
2.538806,192.168.122.20,192.168.121.10,21,55956,TCP,279,275,66,21 > 55956 [ACK] Seq=1 Ack=116409 Win=185088 Len=0 TSval=856794 TSecr=647236
2.539166,192.168.122.20,192.168.121.10,21,55956,TCP,282,,78,[TCP Window Update] 21 > 55956 [ACK] Seq=1 Ack=116409 Win=185856 Len=0 TSval=856794 TSecr=647236 SLE=117857 SRE=119305
2.539374,192.168.122.20,192.168.121.10,21,55956,TCP,284,281,66,21 > 55956 [ACK] Seq=1 Ack=120753 Win=184064 Len=0 TSval=856794 TSecr=647236
2.539522,192.168.122.20,192.168.121.10,21,55956,TCP,287,285,66,21 > 55956 [ACK] Seq=1 Ack=122201 Win=185856 Len=0 TSval=856794 TSecr=647236
2.754775,192.168.122.20,192.168.121.10,21,55956,TCP,291,288,66,21 > 55956 [ACK] Seq=1 Ack=125097 Win=185088 Len=0 TSval=856848 TSecr=647290
2.755064,192.168.122.20,192.168.121.10,21,55956,TCP,293,,78,[TCP Window Update] 21 > 55956 [ACK] Seq=1 Ack=125097 Win=185856 Len=0 TSval=856848 TSecr=647290 SLE=126545 SRE=127993
2.755292,192.168.122.20,192.168.121.10,21,55956,TCP,295,,78,[TCP Dup ACK 293#1] 21 > 55956 [ACK] Seq=1 Ack=125097 Win=185856 Len=0 TSval=856848 TSecr=647290 SLE=126545 SRE=129441
2.755467,192.168.122.20,192.168.121.10,21,55956,TCP,297,,78,[TCP Dup ACK 293#2] 21 > 55956 [ACK] Seq=1 Ack=125097 Win=185856 Len=0 TSval=856848 TSecr=647290 SLE=126545 SRE=130889
2.755614,192.168.122.20,192.168.121.10,21,55956,TCP,299,296,66,21 > 55956 [ACK] Seq=1 Ack=130889 Win=183040 Len=0 TSval=856848 TSecr=647290
2.766587,192.168.122.20,192.168.121.10,21,55956,TCP,303,302,66,21 > 55956 [ACK] Seq=1 Ack=135233 Win=185856 Len=0 TSval=856851 TSecr=647293
2.766818,192.168.122.20,192.168.121.10,21,55956,TCP,306,304,66,21 > 55956 [ACK] Seq=1 Ack=136681 Win=185856 Len=0 TSval=856851 TSecr=647293
2.766975,192.168.122.20,192.168.121.10,21,55956,TCP,308,,78,[TCP Dup ACK 306#1] 21 > 55956 [ACK] Seq=1 Ack=136681 Win=185856 Len=0 TSval=856851 TSecr=647293 SLE=138129 SRE=139577
2.767111,192.168.122.20,192.168.121.10,21,55956,TCP,310,,78,[TCP Dup ACK 306#2] 21 > 55956 [ACK] Seq=1 Ack=136681 Win=185856 Len=0 TSval=856851 TSecr=647293 SLE=138129 SRE=141025
2.767234,192.168.122.20,192.168.121.10,21,55956,TCP,312,,78,[TCP Dup ACK 306#3] 21 > 55956 [ACK] Seq=1 Ack=136681 Win=185856 Len=0 TSval=856851 TSecr=647293 SLE=138129 SRE=142473
2.970915,192.168.122.20,192.168.121.10,21,55956,TCP,315,311,78,21 > 55956 [ACK] Seq=1 Ack=142473 Win=185856 Len=0 TSval=856902 TSecr=647293 SLE=136681 SRE=138129
3.026930,192.168.122.20,192.168.121.10,21,55956,TCP,319,,78,[TCP Dup ACK 315#1] 21 > 55956 [ACK] Seq=1 Ack=142473 Win=185856 Len=0 TSval=856916 TSecr=647293 SLE=143921 SRE=146817
3.027366,192.168.122.20,192.168.121.10,21,55956,TCP,321,,78,[TCP Dup ACK 315#2] 21 > 55956 [ACK] Seq=1 Ack=142473 Win=185856 Len=0 TSval=856916 TSecr=647293 SLE=143921 SRE=148265
3.027598,192.168.122.20,192.168.121.10,21,55956,TCP,323,320,66,21 > 55956 [ACK] Seq=1 Ack=148265 Win=183040 Len=0 TSval=856916 TSecr=647358
3.027785,192.168.122.20,192.168.121.10,21,55956,TCP,326,324,66,21 > 55956 [ACK] Seq=1 Ack=151161 Win=185344 Len=0 TSval=856916 TSecr=647358
3.027810,192.168.122.20,192.168.121.10,21,55956,TCP,329,325,66,21 > 55956 [ACK] Seq=1 Ack=154057 Win=183552 Len=0 TSval=856916 TSecr=647358
3.028094,192.168.122.20,192.168.121.10,21,55956,TCP,332,327,66,21 > 55956 [ACK] Seq=1 Ack=156953 Win=185344 Len=0 TSval=856916 TSecr=647358
3.028133,192.168.122.20,192.168.121.10,21,55956,TCP,335,,78,[TCP Dup ACK 332#1] 21 > 55956 [ACK] Seq=1 Ack=156953 Win=185344 Len=0 TSval=856916 TSecr=647358 SLE=158401 SRE=161297
3.028155,192.168.122.20,192.168.121.10,21,55956,TCP,337,330,66,21 > 55956 [ACK] Seq=1 Ack=161297 Win=182528 Len=0 TSval=856916 TSecr=647358
3.028165,192.168.122.20,192.168.121.10,21,55956,TCP,339,331,66,21 > 55956 [ACK] Seq=1 Ack=162745 Win=181504 Len=0 TSval=856916 TSecr=647358
3.028536,192.168.122.20,192.168.121.10,21,55956,TCP,341,333,66,21 > 55956 [ACK] Seq=1 Ack=165641 Win=185344 Len=0 TSval=856916 TSecr=647358
3.028579,192.168.122.20,192.168.121.10,21,55956,TCP,344,,78,[TCP Dup ACK 341#1] 21 > 55956 [ACK] Seq=1 Ack=165641 Win=185344 Len=0 TSval=856916 TSecr=647358 SLE=169985 SRE=172881
3.028596,192.168.122.20,192.168.121.10,21,55956,TCP,346,,78,[TCP Dup ACK 341#2] 21 > 55956 [ACK] Seq=1 Ack=165641 Win=185344 Len=0 TSval=856916 TSecr=647358 SLE=169985 SRE=175777
3.028615,192.168.122.20,192.168.121.10,21,55956,TCP,349,334,78,21 > 55956 [ACK] Seq=1 Ack=167089 Win=183936 Len=0 TSval=856916 TSecr=647358 SLE=169985 SRE=175777
3.028951,192.168.122.20,192.168.121.10,21,55956,TCP,351,,78,[TCP Dup ACK 349#1] 21 > 55956 [ACK] Seq=1 Ack=167089 Win=183936 Len=0 TSval=856916 TSecr=647358 SLE=169985 SRE=178673
3.028985,192.168.122.20,192.168.121.10,21,55956,TCP,353,,78,[TCP Dup ACK 349#2] 21 > 55956 [ACK] Seq=1 Ack=167089 Win=183936 Len=0 TSval=856916 TSecr=647358 SLE=169985 SRE=180121
3.028999,192.168.122.20,192.168.121.10,21,55956,TCP,355,,78,[TCP Dup ACK 349#3] 21 > 55956 [ACK] Seq=1 Ack=167089 Win=183936 Len=0 TSval=856916 TSecr=647358 SLE=169985 SRE=183017
3.029241,192.168.122.20,192.168.121.10,21,55956,TCP,357,350,78,21 > 55956 [ACK] Seq=1 Ack=183017 Win=185856 Len=0 TSval=856916 TSecr=647358 SLE=185913 SRE=187361
3.029520,192.168.122.20,192.168.121.10,21,55956,TCP,361,,86,[TCP Dup ACK 357#1] 21 > 55956 [ACK] Seq=1 Ack=183017 Win=185856 Len=0 TSval=856917 TSecr=647358 SLE=191705 SRE=194601 SLE=185913 SRE=187361
3.029554,192.168.122.20,192.168.121.10,21,55956,TCP,364,,86,[TCP Dup ACK 357#2] 21 > 55956 [ACK] Seq=1 Ack=183017 Win=185856 Len=0 TSval=856917 TSecr=647358 SLE=190257 SRE=194601 SLE=185913 SRE=187361
3.029820,192.168.122.20,192.168.121.10,21,55956,TCP,366,354,78,21 > 55956 [ACK] Seq=1 Ack=187361 Win=181632 Len=0 TSval=856917 TSecr=647358 SLE=190257 SRE=194601
3.029855,192.168.122.20,192.168.121.10,21,55956,TCP,369,365,78,21 > 55956 [ACK] Seq=1 Ack=188809 Win=180224 Len=0 TSval=856917 TSecr=647358 SLE=190257 SRE=194601
3.030103,192.168.122.20,192.168.121.10,21,55956,TCP,371,,86,[TCP Window Update] 21 > 55956 [ACK] Seq=1 Ack=188809 Win=182272 Len=0 TSval=856917 TSecr=647358 SLE=196049 SRE=198945 SLE=190257 SRE=194601
3.030133,192.168.122.20,192.168.121.10,21,55956,TCP,373,359,78,21 > 55956 [ACK] Seq=1 Ack=194601 Win=181376 Len=0 TSval=856917 TSecr=647358 SLE=196049 SRE=198945
3.030154,192.168.122.20,192.168.121.10,21,55956,TCP,375,,78,[TCP Dup ACK 373#1] 21 > 55956 [ACK] Seq=1 Ack=194601 Win=181376 Len=0 TSval=856917 TSecr=647358 SLE=196049 SRE=200393
3.030397,192.168.122.20,192.168.121.10,21,55956,TCP,377,,78,[TCP Window Update] 21 > 55956 [ACK] Seq=1 Ack=194601 Win=182528 Len=0 TSval=856917 TSecr=647358 SLE=196049 SRE=203289
3.030425,192.168.122.20,192.168.121.10,21,55956,TCP,379,,78,[TCP Dup ACK 377#1] 21 > 55956 [ACK] Seq=1 Ack=194601 Win=182528 Len=0 TSval=856917 TSecr=647358 SLE=196049 SRE=204737
3.030443,192.168.122.20,192.168.121.10,21,55956,TCP,381,374,66,21 > 55956 [ACK] Seq=1 Ack=204737 Win=180480 Len=0 TSval=856917 TSecr=647358
3.030733,192.168.122.20,192.168.121.10,21,55956,TCP,383,378,66,21 > 55956 [ACK] Seq=1 Ack=207633 Win=185344 Len=0 TSval=856917 TSecr=647359
3.030763,192.168.122.20,192.168.121.10,21,55956,TCP,385,,78,[TCP Dup ACK 383#1] 21 > 55956 [ACK] Seq=1 Ack=207633 Win=185344 Len=0 TSval=856917 TSecr=647359 SLE=209081 SRE=213425
3.030788,192.168.122.20,192.168.121.10,21,55956,TCP,388,382,66,21 > 55956 [ACK] Seq=1 Ack=213425 Win=181504 Len=0 TSval=856917 TSecr=647359
3.031054,192.168.122.20,192.168.121.10,21,55956,TCP,390,384,66,21 > 55956 [ACK] Seq=1 Ack=216321 Win=185344 Len=0 TSval=856917 TSecr=647359
3.031091,192.168.122.20,192.168.121.10,21,55956,TCP,392,,78,[TCP Dup ACK 390#1] 21 > 55956 [ACK] Seq=1 Ack=216321 Win=185344 Len=0 TSval=856917 TSecr=647359 SLE=207633 SRE=209081
3.031113,192.168.122.20,192.168.121.10,21,55956,TCP,394,389,66,21 > 55956 [ACK] Seq=1 Ack=219217 Win=183296 Len=0 TSval=856917 TSecr=647359
3.031355,192.168.122.20,192.168.121.10,21,55956,TCP,396,391,66,21 > 55956 [ACK] Seq=1 Ack=222113 Win=185344 Len=0 TSval=856917 TSecr=647359
3.031651,192.168.122.20,192.168.121.10,21,55956,TCP,398,393,66,21 > 55956 [ACK] Seq=1 Ack=225009 Win=185344 Len=0 TSval=856917 TSecr=647359
3.031726,192.168.122.20,192.168.121.10,21,55956,TCP,400,395,66,21 > 55956 [ACK] Seq=1 Ack=229353 Win=182784 Len=0 TSval=856917 TSecr=647359
3.031794,192.168.122.20,192.168.121.10,21,55956,TCP,402,397,66,21 > 55956 [ACK] Seq=1 Ack=232249 Win=185344 Len=0 TSval=856917 TSecr=647359
3.032027,192.168.122.20,192.168.121.10,21,55956,TCP,404,399,66,21 > 55956 [ACK] Seq=1 Ack=236593 Win=184576 Len=0 TSval=856917 TSecr=647359
3.032179,192.168.122.20,192.168.121.10,21,55956,TCP,406,401,66,21 > 55956 [ACK] Seq=1 Ack=240937 Win=182016 Len=0 TSval=856917 TSecr=647359
3.035816,192.168.122.20,192.168.121.10,21,55956,TCP,408,407,66,21 > 55956 [ACK] Seq=1 Ack=255417 Win=184576 Len=0 TSval=856918 TSecr=647360
3.036412,192.168.122.20,192.168.121.10,21,55956,TCP,410,409,66,21 > 55956 [ACK] Seq=1 Ack=258305 Win=191616 Len=0 TSval=856918 TSecr=647360
3.037066,192.168.122.20,192.168.121.10,21,55956,TCP,412,411,66,21 > 55956 [ACK] Seq=1 Ack=258561 Win=194432 Len=0 TSval=856918 TSecr=647360
3.038055,192.168.122.20,192.168.121.10,21,55956,TCP,414,413,66,21 > 55956 [ACK] Seq=1 Ack=258817 Win=197376 Len=0 TSval=856919 TSecr=647360
3.039318,192.168.122.20,192.168.121.10,21,55956,TCP,416,415,66,21 > 55956 [ACK] Seq=1 Ack=259073 Win=200320 Len=0 TSval=856919 TSecr=647361
3.040419,192.168.122.20,192.168.121.10,21,55956,TCP,418,417,66,21 > 55956 [ACK] Seq=1 Ack=259329 Win=203136 Len=0 TSval=856919 TSecr=647361
3.041409,192.168.122.20,192.168.121.10,21,55956,TCP,420,419,66,21 > 55956 [ACK] Seq=1 Ack=259585 Win=206080 Len=0 TSval=856919 TSecr=647361
3.042477,192.168.122.20,192.168.121.10,21,55956,TCP,422,421,66,21 > 55956 [ACK] Seq=1 Ack=259841 Win=208896 Len=0 TSval=856920 TSecr=647361
3.043662,192.168.122.20,192.168.121.10,21,55956,TCP,424,423,66,21 > 55956 [ACK] Seq=1 Ack=260097 Win=211840 Len=0 TSval=856920 TSecr=647362
3.067366,192.168.122.20,192.168.121.10,21,55956,TCP,428,,78,[TCP Window Update] 21 > 55956 [ACK] Seq=1 Ack=260097 Win=214784 Len=0 TSval=856926 TSecr=647362 SLE=261801 SRE=263249
3.072897,192.168.122.20,192.168.121.10,21,55956,TCP,430,,78,[TCP Window Update] 21 > 55956 [ACK] Seq=1 Ack=260097 Win=217600 Len=0 TSval=856927 TSecr=647362 SLE=261801 SRE=264697
3.073316,192.168.122.20,192.168.121.10,21,55956,TCP,432,425,78,21 > 55956 [ACK] Seq=1 Ack=260353 Win=220544 Len=0 TSval=856927 TSecr=647369 SLE=261801 SRE=264697
3.073767,192.168.122.20,192.168.121.10,21,55956,TCP,435,,78,[TCP Dup ACK 432#1] 21 > 55956 [ACK] Seq=1 Ack=260353 Win=220544 Len=0 TSval=856928 TSecr=647369 SLE=261801 SRE=264705
3.079169,192.168.122.20,192.168.121.10,21,55956,TCP,437,,78,[TCP Window Update] 21 > 55956 [ACK] Seq=1 Ack=260353 Win=223488 Len=0 TSval=856929 TSecr=647369 SLE=261801 SRE=266153
3.079495,192.168.122.20,192.168.121.10,21,55956,TCP,439,436,66,21 > 55956 [ACK] Seq=1 Ack=266153 Win=226304 Len=0 TSval=856929 TSecr=647371
3.079765,192.168.122.20,192.168.121.10,21,55956,TCP,441,440,66,21 > 55956 [ACK] Seq=1 Ack=266241 Win=226304 Len=0 TSval=856929 TSecr=647371
3.080005,192.168.122.20,192.168.121.10,21,55956,TCP,443,442,66,21 > 55956 [ACK] Seq=1 Ack=266497 Win=229248 Len=0 TSval=856929 TSecr=647371
3.081025,192.168.122.20,192.168.121.10,21,55956,TCP,445,444,66,21 > 55956 [ACK] Seq=1 Ack=266753 Win=232064 Len=0 TSval=856929 TSecr=647371
3.082092,192.168.122.20,192.168.121.10,21,55956,TCP,447,446,66,21 > 55956 [ACK] Seq=1 Ack=267009 Win=235008 Len=0 TSval=856930 TSecr=647371
3.090473,192.168.122.20,192.168.121.10,21,55956,TCP,450,,78,[TCP Window Update] 21 > 55956 [ACK] Seq=1 Ack=267009 Win=237952 Len=0 TSval=856932 TSecr=647371 SLE=267265 SRE=268713
3.096392,192.168.122.20,192.168.121.10,21,55956,TCP,452,,78,[TCP Window Update] 21 > 55956 [ACK] Seq=1 Ack=267009 Win=240768 Len=0 TSval=856933 TSecr=647371 SLE=267265 SRE=270161
3.101756,192.168.122.20,192.168.121.10,21,55956,TCP,454,,78,[TCP Window Update] 21 > 55956 [ACK] Seq=1 Ack=267009 Win=243712 Len=0 TSval=856935 TSecr=647371 SLE=267265 SRE=271609
3.101956,192.168.122.20,192.168.121.10,21,55956,TCP,456,453,66,21 > 55956 [ACK] Seq=1 Ack=271609 Win=246656 Len=0 TSval=856935 TSecr=647376
3.102100,192.168.122.20,192.168.121.10,21,55956,TCP,458,457,66,21 > 55956 [ACK] Seq=1 Ack=271617 Win=246656 Len=0 TSval=856935 TSecr=647376
3.102618,192.168.122.20,192.168.121.10,21,55956,TCP,460,459,66,21 > 55956 [ACK] Seq=1 Ack=271873 Win=249472 Len=0 TSval=856935 TSecr=647377
3.110928,192.168.122.20,192.168.121.10,21,55956,TCP,463,,78,[TCP Window Update] 21 > 55956 [ACK] Seq=1 Ack=271873 Win=252416 Len=0 TSval=856937 TSecr=647377 SLE=272129 SRE=273577
3.123277,192.168.122.20,192.168.121.10,21,55956,TCP,466,,86,[TCP Window Update] 21 > 55956 [ACK] Seq=1 Ack=271873 Win=255232 Len=0 TSval=856940 TSecr=647377 SLE=275025 SRE=276473 SLE=272129 SRE=273577
3.123475,192.168.122.20,192.168.121.10,21,55956,TCP,468,462,78,21 > 55956 [ACK] Seq=1 Ack=273577 Win=258176 Len=0 TSval=856940 TSecr=647382 SLE=275025 SRE=276473
3.123654,192.168.122.20,192.168.121.10,21,55956,TCP,471,465,66,21 > 55956 [ACK] Seq=1 Ack=276473 Win=261120 Len=0 TSval=856940 TSecr=647382
3.123660,192.168.122.20,192.168.121.10,21,55956,TCP,472,470,66,21 > 55956 [ACK] Seq=1 Ack=276481 Win=261120 Len=0 TSval=856940 TSecr=647382
3.124027,192.168.122.20,192.168.121.10,21,55956,TCP,474,473,66,21 > 55956 [ACK] Seq=1 Ack=276737 Win=263936 Len=0 TSval=856940 TSecr=647382
3.125262,192.168.122.20,192.168.121.10,21,55956,TCP,476,475,66,21 > 55956 [ACK] Seq=1 Ack=276993 Win=266880 Len=0 TSval=856940 TSecr=647382
3.127284,192.168.122.20,192.168.121.10,21,55956,TCP,478,477,66,21 > 55956 [ACK] Seq=1 Ack=277249 Win=269824 Len=0 TSval=856941 TSecr=647382
3.127926,192.168.122.20,192.168.121.10,21,55956,TCP,480,479,66,21 > 55956 [ACK] Seq=1 Ack=277505 Win=272640 Len=0 TSval=856941 TSecr=647383
3.135537,192.168.122.20,192.168.121.10,21,55956,TCP,483,,78,[TCP Window Update] 21 > 55956 [ACK] Seq=1 Ack=277505 Win=275584 Len=0 TSval=856943 TSecr=647383 SLE=277761 SRE=279209
3.142134,192.168.122.20,192.168.121.10,21,55956,TCP,485,,78,[TCP Window Update] 21 > 55956 [ACK] Seq=1 Ack=277505 Win=278400 Len=0 TSval=856945 TSecr=647383 SLE=277761 SRE=280657
3.738822,192.168.122.20,192.168.121.10,21,55956,TCP,489,486,78,21 > 55956 [ACK] Seq=1 Ack=282105 Win=284288 Len=0 TSval=857094 TSecr=647434 SLE=277505 SRE=277761
3.739202,192.168.122.20,192.168.121.10,21,55956,TCP,492,490,66,21 > 55956 [ACK] Seq=1 Ack=285001 Win=290048 Len=0 TSval=857094 TSecr=647536
3.739234,192.168.122.20,192.168.121.10,21,55956,TCP,495,491,66,21 > 55956 [ACK] Seq=1 Ack=287897 Win=295808 Len=0 TSval=857094 TSecr=647536
3.739432,192.168.122.20,192.168.121.10,21,55956,TCP,498,493,66,21 > 55956 [ACK] Seq=1 Ack=290793 Win=301568 Len=0 TSval=857094 TSecr=647536
3.739455,192.168.122.20,192.168.121.10,21,55956,TCP,501,,78,[TCP Window Update] 21 > 55956 [ACK] Seq=1 Ack=290793 Win=304512 Len=0 TSval=857094 TSecr=647536 SLE=295137 SRE=296585
3.739607,192.168.122.20,192.168.121.10,21,55956,TCP,503,,78,[TCP Window Update] 21 > 55956 [ACK] Seq=1 Ack=290793 Win=310272 Len=0 TSval=857094 TSecr=647536 SLE=295137 SRE=299481
3.739628,192.168.122.20,192.168.121.10,21,55956,TCP,506,,78,[TCP Window Update] 21 > 55956 [ACK] Seq=1 Ack=290793 Win=313216 Len=0 TSval=857094 TSecr=647536 SLE=295137 SRE=300929
3.739635,192.168.122.20,192.168.121.10,21,55956,TCP,508,494,78,21 > 55956 [ACK] Seq=1 Ack=292241 Win=316160 Len=0 TSval=857094 TSecr=647536 SLE=295137 SRE=300929
3.739796,192.168.122.20,192.168.121.10,21,55956,TCP,510,504,86,21 > 55956 [ACK] Seq=1 Ack=293689 Win=318720 Len=0 TSval=857094 TSecr=647536 SLE=302377 SRE=303825 SLE=295137 SRE=300929
3.740047,192.168.122.20,192.168.121.10,21,55956,TCP,512,,86,[TCP Dup ACK 510#1] 21 > 55956 [ACK] Seq=1 Ack=293689 Win=318720 Len=0 TSval=857094 TSecr=647536 SLE=302377 SRE=306721 SLE=295137 SRE=300929
3.740197,192.168.122.20,192.168.121.10,21,55956,TCP,515,,78,[TCP Dup ACK 510#2] 21 > 55956 [ACK] Seq=1 Ack=293689 Win=318720 Len=0 TSval=857094 TSecr=647536 SLE=295137 SRE=306721
3.740211,192.168.122.20,192.168.121.10,21,55956,TCP,517,,78,[TCP Dup ACK 510#3] 21 > 55956 [ACK] Seq=1 Ack=293689 Win=318720 Len=0 TSval=857094 TSecr=647536 SLE=295137 SRE=308169
3.740330,192.168.122.20,192.168.121.10,21,55956,TCP,519,,78,[TCP Dup ACK 510#4] 21 > 55956 [ACK] Seq=1 Ack=293689 Win=318720 Len=0 TSval=857094 TSecr=647536 SLE=295137 SRE=311065
3.740445,192.168.122.20,192.168.121.10,21,55956,TCP,522,,78,[TCP Dup ACK 510#5] 21 > 55956 [ACK] Seq=1 Ack=293689 Win=318720 Len=0 TSval=857094 TSecr=647536 SLE=295137 SRE=313961
4.134910,192.168.122.20,192.168.121.10,21,55956,TCP,527,524,66,21 > 55956 [ACK] Seq=1 Ack=316857 Win=310016 Len=0 TSval=857193 TSecr=647635
4.135688,192.168.122.20,192.168.121.10,21,55956,TCP,532,528,66,21 > 55956 [ACK] Seq=1 Ack=319753 Win=318720 Len=0 TSval=857193 TSecr=647635
4.135884,192.168.122.20,192.168.121.10,21,55956,TCP,534,529,66,21 > 55956 [ACK] Seq=1 Ack=322649 Win=318720 Len=0 TSval=857193 TSecr=647635
4.135935,192.168.122.20,192.168.121.10,21,55956,TCP,537,,78,[TCP Dup ACK 534#1] 21 > 55956 [ACK] Seq=1 Ack=322649 Win=318720 Len=0 TSval=857193 TSecr=647635 SLE=325545 SRE=326993
4.136174,192.168.122.20,192.168.121.10,21,55956,TCP,539,,78,[TCP Dup ACK 534#2] 21 > 55956 [ACK] Seq=1 Ack=322649 Win=318720 Len=0 TSval=857193 TSecr=647635 SLE=325545 SRE=329889
4.136201,192.168.122.20,192.168.121.10,21,55956,TCP,541,,86,[TCP Dup ACK 534#3] 21 > 55956 [ACK] Seq=1 Ack=322649 Win=318720 Len=0 TSval=857193 TSecr=647635 SLE=332785 SRE=334233 SLE=325545 SRE=329889
4.136423,192.168.122.20,192.168.121.10,21,55956,TCP,543,533,78,21 > 55956 [ACK] Seq=1 Ack=329889 Win=318720 Len=0 TSval=857193 TSecr=647635 SLE=332785 SRE=335681
4.136565,192.168.122.20,192.168.121.10,21,55956,TCP,547,544,78,21 > 55956 [ACK] Seq=1 Ack=331337 Win=318720 Len=0 TSval=857193 TSecr=647635 SLE=332785 SRE=335681
4.136588,192.168.122.20,192.168.121.10,21,55956,TCP,549,,78,[TCP Dup ACK 547#1] 21 > 55956 [ACK] Seq=1 Ack=331337 Win=318720 Len=0 TSval=857193 TSecr=647635 SLE=332785 SRE=338577
4.136621,192.168.122.20,192.168.121.10,21,55956,TCP,552,,78,[TCP Dup ACK 547#2] 21 > 55956 [ACK] Seq=1 Ack=331337 Win=318720 Len=0 TSval=857193 TSecr=647635 SLE=332785 SRE=340025
4.136744,192.168.122.20,192.168.121.10,21,55956,TCP,554,,78,[TCP Dup ACK 547#3] 21 > 55956 [ACK] Seq=1 Ack=331337 Win=318720 Len=0 TSval=857193 TSecr=647635 SLE=332785 SRE=341473
4.136832,192.168.122.20,192.168.121.10,21,55956,TCP,556,548,66,21 > 55956 [ACK] Seq=1 Ack=341473 Win=318720 Len=0 TSval=857193 TSecr=647635
4.136906,192.168.122.20,192.168.121.10,21,55956,TCP,559,551,66,21 > 55956 [ACK] Seq=1 Ack=342921 Win=318464 Len=0 TSval=857193 TSecr=647635
4.137079,192.168.122.20,192.168.121.10,21,55956,TCP,561,,86,[TCP Window Update] 21 > 55956 [ACK] Seq=1 Ack=342921 Win=318720 Len=0 TSval=857193 TSecr=647635 SLE=347265 SRE=350161 SLE=344369 SRE=345817
4.137118,192.168.122.20,192.168.121.10,21,55956,TCP,564,,78,[TCP Dup ACK 561#1] 21 > 55956 [ACK] Seq=1 Ack=342921 Win=318720 Len=0 TSval=857193 TSecr=647635 SLE=344369 SRE=350161
4.137136,192.168.122.20,192.168.121.10,21,55956,TCP,566,,78,[TCP Dup ACK 561#2] 21 > 55956 [ACK] Seq=1 Ack=342921 Win=318720 Len=0 TSval=857193 TSecr=647635 SLE=344369 SRE=351609
4.137681,192.168.122.20,192.168.121.10,21,55956,TCP,568,,78,[TCP Dup ACK 561#3] 21 > 55956 [ACK] Seq=1 Ack=342921 Win=318720 Len=0 TSval=857194 TSecr=647635 SLE=344369 SRE=355953
4.138310,192.168.122.20,192.168.121.10,21,55956,TCP,571,,78,[TCP Dup ACK 561#4] 21 > 55956 [ACK] Seq=1 Ack=342921 Win=318720 Len=0 TSval=857194 TSecr=647635 SLE=344369 SRE=358849
4.138345,192.168.122.20,192.168.121.10,21,55956,TCP,573,,78,[TCP Dup ACK 561#5] 21 > 55956 [ACK] Seq=1 Ack=342921 Win=318720 Len=0 TSval=857194 TSecr=647635 SLE=344369 SRE=360297
4.138557,192.168.122.20,192.168.121.10,21,55956,TCP,575,,78,[TCP Dup ACK 561#6] 21 > 55956 [ACK] Seq=1 Ack=342921 Win=318720 Len=0 TSval=857194 TSecr=647635 SLE=344369 SRE=363193
4.138589,192.168.122.20,192.168.121.10,21,55956,TCP,578,,78,[TCP Dup ACK 561#7] 21 > 55956 [ACK] Seq=1 Ack=342921 Win=318720 Len=0 TSval=857194 TSecr=647635 SLE=344369 SRE=364641
4.138780,192.168.122.20,192.168.121.10,21,55956,TCP,580,579,66,21 > 55956 [ACK] Seq=1 Ack=367537 Win=309504 Len=0 TSval=857194 TSecr=647636
4.138964,192.168.122.20,192.168.121.10,21,55956,TCP,583,581,66,21 > 55956 [ACK] Seq=1 Ack=376225 Win=318720 Len=0 TSval=857194 TSecr=647636
4.138982,192.168.122.20,192.168.121.10,21,55956,TCP,586,582,66,21 > 55956 [ACK] Seq=1 Ack=384913 Win=314624 Len=0 TSval=857194 TSecr=647636
4.139152,192.168.122.20,192.168.121.10,21,55956,TCP,588,584,66,21 > 55956 [ACK] Seq=1 Ack=395049 Win=318720 Len=0 TSval=857194 TSecr=647636
4.139161,192.168.122.20,192.168.121.10,21,55956,TCP,590,585,66,21 > 55956 [ACK] Seq=1 Ack=397945 Win=318720 Len=0 TSval=857194 TSecr=647636
4.139164,192.168.122.20,192.168.121.10,21,55956,TCP,591,587,66,21 > 55956 [ACK] Seq=1 Ack=410977 Win=311552 Len=0 TSval=857194 TSecr=647636
4.139250,192.168.122.20,192.168.121.10,21,55956,TCP,592,589,66,21 > 55956 [ACK] Seq=1 Ack=412929 Win=309760 Len=0 TSval=857194 TSecr=647636
4.140090,192.168.122.20,192.168.121.10,21,55956,TCP,594,593,66,21 > 55956 [ACK] Seq=1 Ack=413185 Win=318720 Len=0 TSval=857194 TSecr=647636
4.141160,192.168.122.20,192.168.121.10,21,55956,TCP,596,595,66,21 > 55956 [ACK] Seq=1 Ack=413441 Win=318720 Len=0 TSval=857194 TSecr=647636
4.142281,192.168.122.20,192.168.121.10,21,55956,TCP,598,597,66,21 > 55956 [ACK] Seq=1 Ack=413697 Win=318720 Len=0 TSval=857195 TSecr=647636
4.143337,192.168.122.20,192.168.121.10,21,55956,TCP,600,599,66,21 > 55956 [ACK] Seq=1 Ack=413953 Win=318720 Len=0 TSval=857195 TSecr=647637
4.151167,192.168.122.20,192.168.121.10,21,55956,TCP,603,,78,[TCP Dup ACK 600#1] 21 > 55956 [ACK] Seq=1 Ack=413953 Win=318720 Len=0 TSval=857197 TSecr=647637 SLE=414209 SRE=415657
4.163708,192.168.122.20,192.168.121.10,21,55956,TCP,606,,78,[TCP Dup ACK 600#2] 21 > 55956 [ACK] Seq=1 Ack=413953 Win=318720 Len=0 TSval=857200 TSecr=647637 SLE=414209 SRE=418553
4.163941,192.168.122.20,192.168.121.10,21,55956,TCP,608,605,66,21 > 55956 [ACK] Seq=1 Ack=418553 Win=318720 Len=0 TSval=857200 TSecr=647642
4.164096,192.168.122.20,192.168.121.10,21,55956,TCP,610,609,66,21 > 55956 [ACK] Seq=1 Ack=418561 Win=318720 Len=0 TSval=857200 TSecr=647642
4.164412,192.168.122.20,192.168.121.10,21,55956,TCP,612,611,66,21 > 55956 [ACK] Seq=1 Ack=418817 Win=318720 Len=0 TSval=857200 TSecr=647642
4.165485,192.168.122.20,192.168.121.10,21,55956,TCP,614,613,66,21 > 55956 [ACK] Seq=1 Ack=419073 Win=318720 Len=0 TSval=857201 TSecr=647642
4.166559,192.168.122.20,192.168.121.10,21,55956,TCP,616,615,66,21 > 55956 [ACK] Seq=1 Ack=419329 Win=318720 Len=0 TSval=857201 TSecr=647643
4.167665,192.168.122.20,192.168.121.10,21,55956,TCP,618,617,66,21 > 55956 [ACK] Seq=1 Ack=419585 Win=318720 Len=0 TSval=857201 TSecr=647643
4.168740,192.168.122.20,192.168.121.10,21,55956,TCP,620,619,66,21 > 55956 [ACK] Seq=1 Ack=419841 Win=318720 Len=0 TSval=857201 TSecr=647643
4.169821,192.168.122.20,192.168.121.10,21,55956,TCP,622,621,66,21 > 55956 [ACK] Seq=1 Ack=420097 Win=318720 Len=0 TSval=857202 TSecr=647643
4.170900,192.168.122.20,192.168.121.10,21,55956,TCP,624,623,66,21 > 55956 [ACK] Seq=1 Ack=420353 Win=318720 Len=0 TSval=857202 TSecr=647644
